tmdbId,guideBoxId,title,year,genre,rating,director,actors,poster,backdrop,trailer,plot,rec1,rec2,rec3,created_at
11,55413,"Star Wars: Episode IV - A New Hope",1977,"Action, Adventure, Fantasy",PG,"George Lucas","Mark Hamill, Harrison Ford, Carrie Fisher, Peter Cushing",http://image.tmdb.org/t/p/w500/tvSlBzAdRE29bZe5yYWrJ2ds137.jpg,http://image.tmdb.org/t/p/original/4iJfYYoQzZcONB9hNzg0J0wWyPH.jpg,http://www.youtube.com/embed/vZ734NWnAHA?rel=0&autoplay=1,"Luke Skywalker joins forces with a Jedi Knight, a cocky pilot, a wookiee and two droids to save the galaxy from the Empire's world-destroying battle-station, while also attempting to rescue Princess Leia from the evil Darth Vader.","The Empire Strikes Back, 1891, http://image.tmdb.org/t/p/w500/6u1fYtxG5eqjhtCPDx04pJphQRW.jpg","Return of the Jedi, 1892, http://image.tmdb.org/t/p/w500/jx5p0aHlbPXqe3AH9G15NvmWaqQ.jpg","Star Wars: Episode I - The Phantom Menace, 1893, http://image.tmdb.org/t/p/w500/n8V09dDc02KsSN6Q4hC2BX6hN8X.jpg","2017-05-14 20:42:22"
129,13996,"Spirited Away",2001,"Animation, Adventure, Family",PG,"Hayao Miyazaki","Rumi Hiiragi, Miyu Irino, Mari Natsuki, Takashi Naitô",http://image.tmdb.org/t/p/w500/ynXoOxmDHNQ4UAy0oU6avW71HVW.jpg,http://image.tmdb.org/t/p/original/mnpRKVSXBX6jb56nabvmGKA0Wig.jpg,http://www.youtube.com/embed/0lzccY1-PNs?rel=0&autoplay=1,"During her family's move to the suburbs, a sullen 10-year-old girl wanders into a world ruled by gods, witches, and spirits, and where humans are changed into beasts.","Howl's Moving Castle, 4935, http://image.tmdb.org/t/p/w500/iMarB2ior30OAXjPa7QIdeyUfM1.jpg","Princess Mononoke, 128, http://image.tmdb.org/t/p/w500/gzlJkVfWV5VEG5xK25cvFGJgkDz.jpg","My Neighbor Totoro, 8392, http://image.tmdb.org/t/p/w500/2i0OOjvi7CqNQA6ZtYJtL65P9oZ.jpg","2017-05-14 20:42:22"
218,46690,"The Terminator",1984,"Action, Sci-Fi",R,"James Cameron","Arnold Schwarzenegger, Michael Biehn, Linda Hamilton, Paul Winfield",http://image.tmdb.org/t/p/w500/q8ffBuxQlYOHrvPniLgCbmKK4Lv.jpg,http://image.tmdb.org/t/p/original/6yFoLNQgFdVbA8TZMdfgVpszOla.jpg,http://www.youtube.com/embed/k64P4l2Wmeg?rel=0&autoplay=1,"A seemingly indestructible humanoid cyborg is sent from 2029 to 1984 to assassinate a waitress, whose unborn son will lead humanity in a war against the machines, while a soldier from that war is sent to protect her at all costs.","Terminator 2: Judgment Day, 280, http://image.tmdb.org/t/p/w500/2y4dmgWYRMYXdD1UyJVcn2HSd1D.jpg","Terminator 3: Rise of the Machines, 296, http://image.tmdb.org/t/p/w500/lz4xYdF1n09lyiCfZWtWT44SZiG.jpg","Terminator Salvation, 534, http://image.tmdb.org/t/p/w500/hxDfhavtxA2Ayx7O9BsQMcZRdG0.jpg","2017-05-14 22:49:40"
238,37865,"The Godfather",1972,"Crime, Drama",R,"Francis Ford Coppola","Marlon Brando, Al Pacino, James Caan, Richard S. Castellano",http://image.tmdb.org/t/p/w500/rPdtLWNsZmAtoZl9PK7S2wE3qiS.jpg,http://image.tmdb.org/t/p/original/6xKCYgH16UuwEGAyroLU6p8HLIn.jpg,"Sorry, No trailer is currently available","The aging patriarch of an organized crime dynasty transfers control of his clandestine empire to his reluctant son.","The Godfather: Part II, 240, http://image.tmdb.org/t/p/w500/bVq65huQ8vHDd1a4Z37QtuyEvpA.jpg","The Godfather: Part III, 242, http://image.tmdb.org/t/p/w500/1hdm3Axw9LjITbApvAXBbqO58zE.jpg","GoodFellas, 769, http://image.tmdb.org/t/p/w500/hAPeXBdGDGmXRPj4OZZ0poH65Iu.jpg","2017-05-14 20:42:23"
274,76254,"The Silence of the Lambs",1991,"Crime, Drama, Thriller",R,"Jonathan Demme","Jodie Foster, Lawrence A. Bonney, Kasi Lemmons, Lawrence T. Wrentz",http://image.tmdb.org/t/p/w500/qjAyTj2BSth1EQ89vNfo0JYVPFN.jpg,http://image.tmdb.org/t/p/original/upTn8UYt1n92opIEIyzh8HljB0F.jpg,http://www.youtube.com/embed/W6Mm8Sbe__o?rel=0&autoplay=1,"A young F.B.I. cadet must confide in an incarcerated and manipulative killer to receive his help on catching another serial killer who skins his victims.","Hannibal, 9740, http://image.tmdb.org/t/p/w500/v5wAZwRqpGWmyAaaJ8BBHYuNXnj.jpg","The Sixth Sense, 745, http://image.tmdb.org/t/p/w500/imps263dHNe3SuoaAJORZyNTdDT.jpg","The Usual Suspects, 629, http://image.tmdb.org/t/p/w500/jgJoRWltoS17nD5MAQ1yK2Ztefw.jpg","2017-05-14 20:42:23"
280,1593,"Terminator 2: Judgment Day",1991,"Action, Sci-Fi, Thriller",R,"James Cameron","Arnold Schwarzenegger, Linda Hamilton, Edward Furlong, Robert Patrick",http://image.tmdb.org/t/p/w500/2y4dmgWYRMYXdD1UyJVcn2HSd1D.jpg,http://image.tmdb.org/t/p/original/d9AqtruwS8nljKjL5aYzM42hQJr.jpg,http://www.youtube.com/embed/lwSysg9o7wE?rel=0&autoplay=1,"A cyborg, identical to the one who failed to kill Sarah Connor, must now protect her teenage son, John Connor, from a more advanced cyborg.","The Terminator, 218, http://image.tmdb.org/t/p/w500/q8ffBuxQlYOHrvPniLgCbmKK4Lv.jpg","Terminator 3: Rise of the Machines, 296, http://image.tmdb.org/t/p/w500/lz4xYdF1n09lyiCfZWtWT44SZiG.jpg","Terminator Salvation, 534, http://image.tmdb.org/t/p/w500/hxDfhavtxA2Ayx7O9BsQMcZRdG0.jpg","2017-05-15 02:34:03"
429,24276,"The Good, the Bad and the Ugly",1966,Western,APPROVED,"Sergio Leone","Eli Wallach, Clint Eastwood, Lee Van Cleef, Aldo Giuffrè",http://image.tmdb.org/t/p/w500/wfPHdfofBD5PN96dV96a51B3Ja2.jpg,http://image.tmdb.org/t/p/original/xGC2fY5KFmtuXnsuQwYQKFOLZFy.jpg,http://www.youtube.com/embed/WCN5JJY_wiA?rel=0&autoplay=1,"A bounty hunting scam joins two men in an uneasy alliance against a third in a race to find a fortune in gold buried in a remote cemetery.","For a Few Dollars More, 938, http://image.tmdb.org/t/p/w500/o4y1dlqXFETChi1QW2TspfrCJ8e.jpg","A Fistful of Dollars, 391, http://image.tmdb.org/t/p/w500/sFLgxvtK9vxbNq502peVJ847Owp.jpg","Once Upon a Time in the West, 335, http://image.tmdb.org/t/p/w500/giwzmbbRZDva184wBOHDXlrmBa3.jpg","2017-05-14 20:42:23"
433,62075,"Mary Poppins",1964,"Comedy, Family, Fantasy",G,"Robert Stevenson","Julie Andrews, Dick Van Dyke, David Tomlinson, Glynis Johns",http://image.tmdb.org/t/p/w500/cjIIKTkeE8eKAmYULEZg6wKPZVe.jpg,http://image.tmdb.org/t/p/original/7DbgR36Sct5gcyEAzoM8bqiTYUV.jpg,http://www.youtube.com/embed/cXMvCTLIaqM?rel=0&autoplay=1,"In turn of the century London, a magical nanny employs music and adventure to help two neglected children become closer to their father.","The Sound of Music, 15121, http://image.tmdb.org/t/p/w500/459fPVvI4lkEV0piSfcq0irKHi8.jpg","Fantasia, 756, http://image.tmdb.org/t/p/w500/mSJgxrTaTgDSOoggIPcj3ZoZswT.jpg","Bambi, 3170, http://image.tmdb.org/t/p/w500/laABfcpEKweQsaZwCWzmGNUpij9.jpg","2017-05-14 20:42:22"
521,28388,"Dial M for Murder",1954,"Crime, Film-Noir, Thriller",PG,"Alfred Hitchcock","Ray Milland, Grace Kelly, Robert Cummings, John Williams",http://image.tmdb.org/t/p/w500/xrpK1PyckNWmRxU4kZURfaCyboS.jpg,http://image.tmdb.org/t/p/original/kmSrCmhF3mB15woqQ7z3Y4UGRwr.jpg,http://www.youtube.com/embed/urIXnyF0aJ0?rel=0&autoplay=1,"An ex-tennis pro carries out a plot to murder his wife. When things go wrong, he improvises a brilliant plan B.","Strangers on a Train, 845, http://image.tmdb.org/t/p/w500/akslUekHOWvE0UFBVb4GRkxRRoi.jpg","Rope, 1580, http://image.tmdb.org/t/p/w500/9UlEZpKqJPoaFu1OfHM3BohSRUo.jpg","Notorious, 303, http://image.tmdb.org/t/p/w500/pi5YexkEQ9BZIWovB5SyPmjCBjG.jpg","2017-05-14 20:42:22"
599,11250,"Sunset Boulevard",1950,"Drama, Film-Noir",PASSED,"Billy Wilder","William Holden, Gloria Swanson, Erich von Stroheim, Nancy Olson",http://image.tmdb.org/t/p/w500/oFwzvRgfxJc0FUr2mwYTi10dk3G.jpg,http://image.tmdb.org/t/p/original/49OTCCPYlARRe2JS1PAhPJmFkIW.jpg,http://www.youtube.com/embed/klM1GSJsblQ?rel=0&autoplay=1,"A screenwriter is hired to rework a faded silent film star's script only to find himself developing a dangerous relationship.","Witness for the Prosecution, 37257, http://image.tmdb.org/t/p/w500/heY0CCUqN4DY3X30thssZkvWZwx.jpg","Double Indemnity, 996, http://image.tmdb.org/t/p/w500/q6Zs4YMbIBuEfCHCtufwPOkyIVz.jpg","The Apartment, 284, http://image.tmdb.org/t/p/w500/8nrQKQjD6z0SJouKHQapXzmjFc6.jpg","2017-05-14 20:42:23"
621,20730,Grease,1978,"Musical, Romance",PG-13,"Randal Kleiser","John Travolta, Olivia Newton-John, Stockard Channing, Jeff Conaway",http://image.tmdb.org/t/p/w500/iMHdFTrCYhue74sBnXkdO39AJ3R.jpg,http://image.tmdb.org/t/p/original/dSukjx8A3kOitewpG2n7HuRt4rH.jpg,http://www.youtube.com/embed/wzWmxjYNfz4?rel=0&autoplay=1,"Good girl Sandy and greaser Danny fell in love over the summer. When they unexpectedly discover they're now in the same high school, will they be able to rekindle their romance?","Dirty Dancing, 88, http://image.tmdb.org/t/p/w500/zMHIZHxKv6kdE3JFQqZFqj7OswK.jpg","Pretty Woman, 114, http://image.tmdb.org/t/p/w500/fgmdaCMxXClZm2ePteLzCPySB1n.jpg","Saturday Night Fever, 11009, http://image.tmdb.org/t/p/w500/uC0GIPI54UiqrIQsnq6C0qXSIwp.jpg","2017-05-14 20:42:22"
824,76975,"Moulin Rouge!",2001,"Drama, Musical, Romance",PG-13,"Baz Luhrmann","Nicole Kidman, Ewan McGregor, John Leguizamo, Jim Broadbent",http://image.tmdb.org/t/p/w500/xhuQz2yKPlWvMvvnf2u9RVkAQx6.jpg,http://image.tmdb.org/t/p/original/qj3TAGH89t8nkdTH7N6Ge1HTvGj.jpg,http://www.youtube.com/embed/dtEgAx80NC4?rel=0&autoplay=1,"A poet falls for a beautiful courtesan whom a jealous duke covets.","Chicago, 1574, http://image.tmdb.org/t/p/w500/18pCc2XZ5MO7wsywOYEbhoeuxNw.jpg","Shakespeare in Love, 1934, http://image.tmdb.org/t/p/w500/sAN5jedynbs3pa3ww0UXQ1k0lRF.jpg","Australia, 6972, http://image.tmdb.org/t/p/w500/lgnwsUpqmEz40guXX92ACETptpB.jpg","2017-05-14 20:42:23"
920,71875,Cars,2006,"Animation, Adventure, Comedy",G,"John Lasseter, Joe Ranft","Owen Wilson, Paul Newman, Bonnie Hunt, Larry the Cable Guy",http://image.tmdb.org/t/p/w500/5damnMcRFKSjhCirgX3CMa88MBj.jpg,http://image.tmdb.org/t/p/original/a1MlbLBk5Sy6YvMbSuKfwGlDVlb.jpg,http://www.youtube.com/embed/SbXIj2T-_uk?rel=0&autoplay=1,"A hot-shot race-car named Lightning McQueen gets waylaid in Radiator Springs, where he finds the true meaning of friendship and family.","Cars 2, 49013, http://image.tmdb.org/t/p/w500/AblhtULOVtrkSnFxRPQ8gBemxw9.jpg","Madagascar, 953, http://image.tmdb.org/t/p/w500/2YiESGB68BGQSAFvfJxBi774sc4.jpg","Monsters, Inc., 585, http://image.tmdb.org/t/p/w500/93Y9BGx8blzmZOPSoivkFfaifqU.jpg","2017-05-14 20:42:22"
963,73753,"The Maltese Falcon",1941,"Crime, Film-Noir, Mystery",APPROVED,"John Huston","Humphrey Bogart, Mary Astor, Gladys George, Peter Lorre",http://image.tmdb.org/t/p/w500/95OOYSeegOX4XW8nAeFJSIdxfM4.jpg,http://image.tmdb.org/t/p/original/hQGUl6rlAfUFifCLb9bukpJH42P.jpg,http://www.youtube.com/embed/ognCw56CjFw?rel=0&autoplay=1,"A private detective takes on a case that involves him with three eccentric criminals, a gorgeous liar, and their quest for a priceless statuette.","The Treasure of the Sierra Madre, 3090, http://image.tmdb.org/t/p/w500/e3lYTRwiDVPQv07xKldwlLAXikN.jpg","The Big Sleep, 910, http://image.tmdb.org/t/p/w500/ttUJSTKBdu1dR8d24FaoS4S1GFJ.jpg","Double Indemnity, 996, http://image.tmdb.org/t/p/w500/q6Zs4YMbIBuEfCHCtufwPOkyIVz.jpg","2017-05-14 20:42:23"
1092,66981,"The Third Man",1949,"Film-Noir, Mystery, Thriller",APPROVED,"Carol Reed","Joseph Cotten, Alida Valli, Orson Welles, Trevor Howard",http://image.tmdb.org/t/p/w500/xsVmiQG7s2T0UIctSpDvpNv9CX5.jpg,http://image.tmdb.org/t/p/original/lrIuSWdC1LfKJZUnBX6axJxzZGe.jpg,http://www.youtube.com/embed/F-QWLAndD1E?rel=0&autoplay=1,"Pulp novelist Holly Martins travels to shadowy, postwar Vienna, only to find himself investigating the mysterious death of an old friend, Harry Lime.","The Treasure of the Sierra Madre, 3090, http://image.tmdb.org/t/p/w500/e3lYTRwiDVPQv07xKldwlLAXikN.jpg","The Maltese Falcon, 963, http://image.tmdb.org/t/p/w500/95OOYSeegOX4XW8nAeFJSIdxfM4.jpg","Touch of Evil, 1480, http://image.tmdb.org/t/p/w500/4fkBpBB461nZhee5vb8uVsiBAQM.jpg","2017-05-14 20:42:23"
1124,24286,"The Prestige",2006,"Drama, Mystery, Sci-Fi",PG-13,"Christopher Nolan","Hugh Jackman, Christian Bale, Michael Caine, Piper Perabo",http://image.tmdb.org/t/p/w500/5MXyQfz8xUP3dIFPTubhTsbFY6N.jpg,http://image.tmdb.org/t/p/original/c5o7FN2vzI7xlU6IF1y64mgcH9E.jpg,http://www.youtube.com/embed/ijXruSzfGEc?rel=0&autoplay=1,"Two stage magicians engage in competitive one-upmanship in an attempt to create the ultimate stage illusion.","Memento, 77, http://image.tmdb.org/t/p/w500/fQMSaP88cf1nz4qwuNEEFtazuDM.jpg","The Illusionist, 1491, http://image.tmdb.org/t/p/w500/sRYw9oAiporMpq1GWcYHqmpdeAO.jpg","The Departed, 1422, http://image.tmdb.org/t/p/w500/tGLO9zw5ZtCeyyEWgbYGgsFxC6i.jpg","2017-05-15 02:49:11"
1422,17315,"The Departed",2006,"Crime, Drama, Thriller",R,"Martin Scorsese","Leonardo DiCaprio, Matt Damon, Jack Nicholson, Mark Wahlberg",http://image.tmdb.org/t/p/w500/tGLO9zw5ZtCeyyEWgbYGgsFxC6i.jpg,http://image.tmdb.org/t/p/original/8Od5zV7Q7zNOX0y9tyNgpTmoiGA.jpg,http://www.youtube.com/embed/auYbpnEwBBg?rel=0&autoplay=1,"An undercover cop and a mole in the police attempt to identify each other while infiltrating an Irish gang in South Boston.","Blood Diamond, 1372, http://image.tmdb.org/t/p/w500/wRamTzV6udKaMXrspxqOuo02zk0.jpg","The Prestige, 1124, http://image.tmdb.org/t/p/w500/5MXyQfz8xUP3dIFPTubhTsbFY6N.jpg","The Bourne Identity, 2501, http://image.tmdb.org/t/p/w500/bXQIL36VQdzJ69lcjQR1WQzJqQR.jpg","2017-05-15 02:49:16"
1726,67925,"Iron Man",2008,"Action, Adventure, Sci-Fi",PG-13,"Jon Favreau","Robert Downey Jr., Terrence Howard, Jeff Bridges, Gwyneth Paltrow",http://image.tmdb.org/t/p/w500/s2IG9qXfhJYxIttKyroYFBsHwzQ.jpg,http://image.tmdb.org/t/p/original/ZQixhAZx6fH1VNafFXsqa1B8QI.jpg,http://www.youtube.com/embed/KAE5ymVLmZg?rel=0&autoplay=1,"After being held captive in an Afghan cave, billionaire engineer Tony Stark creates a unique weaponized suit of armor to fight evil.","Iron Man 2, 10138, http://image.tmdb.org/t/p/w500/ArqpkNYGfcTIA6umWt6xihfIZZv.jpg","Captain America: The First Avenger, 1771, http://image.tmdb.org/t/p/w500/vSNxAJTlD0r02V9sPYpOjqDZXUK.jpg","Thor, 10195, http://image.tmdb.org/t/p/w500/bIuOWTtyFPjsFDevqvF3QrD1aun.jpg","2017-05-14 20:42:22"
2670,9481,It,1990,"Drama, Fantasy, Horror",TV-14,N/A,"Harry Anderson, Dennis Christopher, Richard Masur, Annette O'Toole",http://image.tmdb.org/t/p/w500/paW0Tc8qNsddCuMJ9M1WnNgOvy1.jpg,http://image.tmdb.org/t/p/original/aSBudWGGhrRrkWAbG3U3mHOs8kg.jpg,http://www.youtube.com/embed/iMspVKv56vQ?rel=0&autoplay=1,"In 1960, seven pre-teen outcasts fight an evil demon who poses as a child-killing clown. Thirty years later, they reunite to stop the demon once and for all when it returns to their hometown.","Pet Sematary, 8913, http://image.tmdb.org/t/p/w500/9zUax4pjRgoPIJla9CQejqNJofB.jpg","Christine, 8769, http://image.tmdb.org/t/p/w500/eIFakrk7xLwiNNoiottTBN5EIwy.jpg","Candyman, 9529, http://image.tmdb.org/t/p/w500/w5YQqrwzreHfa7RmXCB7rpLLxbe.jpg","2017-05-14 20:42:22"
3034,63526,"Young Frankenstein",1974,Comedy,PG,"Mel Brooks","Gene Wilder, Peter Boyle, Marty Feldman, Madeline Kahn",http://image.tmdb.org/t/p/w500/a3Bj2ht6liBFafNM46hqk9WEhcY.jpg,http://image.tmdb.org/t/p/original/xniibygKalBzJg2yCugPwZCJe31.jpg,http://www.youtube.com/embed/7csc1O21jDU?rel=0&autoplay=1,"An American grandson of the infamous scientist, struggling to prove that he is not as insane as people believe, is invited to Transylvania, where he discovers the process that reanimates a dead body.","Blazing Saddles, 11072, http://image.tmdb.org/t/p/w500/yccgwPNVaqtgS1d0U5jjM6Mnza8.jpg","The Producers, 30197, http://image.tmdb.org/t/p/w500/iqKheDdYS3XFvd6cpr6QR9rxdlk.jpg","Animal House, 8469, http://image.tmdb.org/t/p/w500/AuJkgAh7zAGsm7Oo3CGyDtYvzg0.jpg","2017-05-14 20:42:23"
3309,45834,"Mildred Pierce",1945,"Crime, Drama, Film-Noir","NOT RATED","Michael Curtiz","Joan Crawford, Jack Carson, Zachary Scott, Eve Arden",http://image.tmdb.org/t/p/w500/WP1oQxIyGAIVfavlXcxkucCZAO.jpg,http://image.tmdb.org/t/p/original/5npM2IwrVtYEpd3xVnFVNx0kxN.jpg,http://www.youtube.com/embed/qdRfuQ8Y8rU?rel=0&autoplay=1,"A hard-working mother inches towards disaster as she divorces her husband and starts a successful restaurant business to support her spoiled daughter.","I Am a Fugitive from a Chain Gang, 29740, http://image.tmdb.org/t/p/w500/4MXCDU9C1g1Z1CgYuLRzlG1QJTS.jpg","Pickup on South Street, 25955, http://image.tmdb.org/t/p/w500/hUP1WoSQvJXfymSS15IFjJbHLKi.jpg","Sweet Smell of Success, 976, http://image.tmdb.org/t/p/w500/dZBi7DSd3zjraZY1mxYeI5JohOr.jpg","2017-05-14 20:42:22"
4133,34901,Blow,2001,"Biography, Crime, Drama",R,"Ted Demme","Johnny Depp, Penélope Cruz, Franka Potente, Rachel Griffiths",http://image.tmdb.org/t/p/w500/yCLLbZzAa7jreGus7pvjZmL0bj7.jpg,http://image.tmdb.org/t/p/original/lVlzUCVxMZCMnZxwauBK92jBS2b.jpg,http://www.youtube.com/embed/q8lGHQn_n9Y?rel=0&autoplay=1,"The story of George Jung, the man who established the American cocaine market in the 1970s.","Donnie Brasco, 9366, http://image.tmdb.org/t/p/w500/niqDLxwZ6GF0GLKUlkdKnOWfsvb.jpg","Fear and Loathing in Las Vegas, 1878, http://image.tmdb.org/t/p/w500/u9ffgobMADj6GCafeImbov566j9.jpg","Casino, 524, http://image.tmdb.org/t/p/w500/xo517ibXBDdYQY81j0WIG7BVcWq.jpg","2017-05-14 20:42:22"
4479,28152,"Les Miserables",1978,"Drama, History",N/A,"Glenn Jordan","Richard Jordan, Anthony Perkins, Cyril Cusack, Claude Dauphin",http://image.tmdb.org/t/p/w500/pKjYhzIOjZ2knZqibjkoc5rvEcm.jpg,http://image.tmdb.org/t/p/originalnull,"Sorry, No trailer is currently available","Jean Valjean, convicted of stealing bread, is hounded for decades by the relentless and cruel policeman Javert.","George Wallace, 61445, http://image.tmdb.org/t/p/w500/edhs7A0EYrEEzvT1rajWtNC5bH0.jpg","Frankenstein: The True Story, 3105, http://image.tmdb.org/t/p/w500/xaFr9TowExdfReYA0aV5bTQTscH.jpg","The Man in the Iron Mask, 4199, http://image.tmdb.org/t/p/w500/30JmeTsNT1CCsGGEyveTdDW1tCT.jpg","2017-05-14 20:42:22"
5548,16034,RoboCop,1987,"Action, Crime, Sci-Fi",R,"Paul Verhoeven","Peter Weller, Nancy Allen, Dan O'Herlihy, Ronny Cox",http://image.tmdb.org/t/p/w500/gtGreTdzYBuQsEwTliEFdTzPleV.jpg,http://image.tmdb.org/t/p/original/cCu1TazB95Fykw3min9W0lgLNUs.jpg,http://www.youtube.com/embed/c3W5HUz7vyY?rel=0&autoplay=1,"In a dystopic and crime-ridden Detroit, a terminally wounded cop returns to the force as a powerful cyborg haunted by submerged memories.","RoboCop 2, 5549, http://image.tmdb.org/t/p/w500/jHE1jOJQILXSPudL4h94NI3TRL.jpg","Total Recall, 861, http://image.tmdb.org/t/p/w500/ikYpJ0AjGBNnAYFnPJDUVIOcduR.jpg","Starship Troopers, 563, http://image.tmdb.org/t/p/w500/zeCD9WkhABFJmPq3SlTozXJGEtr.jpg","2017-05-14 22:05:10"
6522,20781,Life,1999,"Comedy, Crime, Drama",R,"Ted Demme","Eddie Murphy, Martin Lawrence, Obba Babatundé, Nick Cassavetes",http://image.tmdb.org/t/p/w500/c9phL8FXuL7i15CrjQH5PfM60NB.jpg,http://image.tmdb.org/t/p/original/qDvtbrCrK29qcBACXNFtuHO2aJM.jpg,http://www.youtube.com/embed/_0LkiWPmnns?rel=0&autoplay=1,"The story of wrongfully convicted men (Eddie Murphy and Martin Lawrence) who discover the value of life after serving 65 years in prison.","Bulletproof, 10723, http://image.tmdb.org/t/p/w500/fUIX9vUzaku5KFLV1fNlDEExr3k.jpg","Down to Earth, 16300, http://image.tmdb.org/t/p/w500/zp6hH5R0sFMpGDkTdmpSQozkBVA.jpg","Metro, 8860, http://image.tmdb.org/t/p/w500/5fLP5go9bMQImOZUo72YLcHspau.jpg","2017-05-14 20:42:22"
7445,39485,Brothers,2009,"Drama, Thriller, War",R,"Jim Sheridan","Tobey Maguire, Jake Gyllenhaal, Natalie Portman, Sam Shepard",http://image.tmdb.org/t/p/w500/rfLmpW2tzI40g91GiU0WSiMIxox.jpg,http://image.tmdb.org/t/p/original/5wWe5mAZ8vK6dv8YLtHuqmgTO1u.jpg,http://www.youtube.com/embed/kJtEUfSAfOk?rel=0&autoplay=1,"A young man comforts his older brother's wife and children after he goes missing in Afghanistan.","Jarhead, 25, http://image.tmdb.org/t/p/w500/iEYnXqUsfTaKwO1svSa39Ap07of.jpg","Revolutionary Road, 4148, http://image.tmdb.org/t/p/w500/bnOK1lmdlqdy2HX6IgKx9TQD7Ax.jpg","The Good Girl, 9962, http://image.tmdb.org/t/p/w500/gXUh1LQ8g2rOKNzmOCe3tjfnsZR.jpg","2017-05-14 20:42:23"
8587,51100,"The Lion King",1994,"Animation, Adventure, Drama",G,"Roger Allers, Rob Minkoff","Rowan Atkinson, Matthew Broderick, Niketa Calame, Jim Cummings",http://image.tmdb.org/t/p/w500/bKPtXn9n4M4s8vvZrbw40mYsefB.jpg,http://image.tmdb.org/t/p/original/6lL49SOgBtqiXMs7Y5HWBYH3X9Z.jpg,http://www.youtube.com/embed/4sj1MT05lAA?rel=0&autoplay=1,"Lion cub and future king Simba searches for his identity. His eagerness to please others and penchant for testing his boundaries sometimes gets him into trouble.","Aladdin, 812, http://image.tmdb.org/t/p/w500/qsHpmqekgeQKMKL8PWnFsrXTXGs.jpg","Finding Nemo, 12, http://image.tmdb.org/t/p/w500/zjqInUwldOBa0q07fOyohYCWxWX.jpg","Toy Story, 862, http://image.tmdb.org/t/p/w500/rhIRbceoE9lR4veEXuwCC2wARtG.jpg","2017-05-14 20:42:23"
9323,78602,"Ghost in the Shell",1995,"Animation, Action, Crime","NOT RATED","Mamoru Oshii","Atsuko Tanaka, Akio Ôtsuka, Kôichi Yamadera, Yutaka Nakano",http://image.tmdb.org/t/p/w500/hnkvMdSlavMNGadokPD5tImTgrs.jpg,http://image.tmdb.org/t/p/original/jaiaRiiaunJ8faob9vZ8XBTx9ou.jpg,http://www.youtube.com/embed/wNtgA5Xfd2s?rel=0&autoplay=1,"A cyborg policewoman and her partner hunt a mysterious and powerful hacker called the Puppet Master.","Ghost in the Shell 2: Innocence, 12140, http://image.tmdb.org/t/p/w500/1KSMfpMWMzlvR2DN2fzv31vZ66B.jpg","Akira, 149, http://image.tmdb.org/t/p/w500/8Pt7hlu7fkc5IIR0VZ2kNGY8sT4.jpg","Ghost in the Shell 2.0, 14092, http://image.tmdb.org/t/p/w500/ygMORms9SJaW8P5hdXsuFRDW4WV.jpg","2017-05-14 20:42:22"
10020,42116,"Beauty and the Beast",1991,"Animation, Family, Fantasy",G,"Gary Trousdale, Kirk Wise","Robby Benson, Jesse Corti, Rex Everhart, Angela Lansbury",http://image.tmdb.org/t/p/w500/b9QJr2oblOu1grgOMUZF1xkUJdh.jpg,http://image.tmdb.org/t/p/original/r1xLXJ05bG8hV02No3xNhi8ZcK5.jpg,http://www.youtube.com/embed/tRlzmyveDHE?rel=0&autoplay=1,"A young woman whose father has been imprisoned by a terrifying beast offers herself in his place, unaware that her captor is actually a prince, physically altered by a magic spell.","Aladdin, 812, http://image.tmdb.org/t/p/w500/qsHpmqekgeQKMKL8PWnFsrXTXGs.jpg","The Little Mermaid, 10144, http://image.tmdb.org/t/p/w500/ujlSe3lhp1OKmF2LNu6wRpWbdiU.jpg","Snow White and the Seven Dwarfs, 408, http://image.tmdb.org/t/p/w500/wbVGRBYPRRahIZNGXY9TfHDUSc2.jpg","2017-05-14 20:42:22"
10674,20474,Mulan,1998,"Animation, Adventure, Family",G,"Tony Bancroft, Barry Cook","Miguel Ferrer, Harvey Fierstein, Freda Foh Shen, June Foray",http://image.tmdb.org/t/p/w500/vXjfMyXHixdEEkqcuWS6hy3EZAG.jpg,http://image.tmdb.org/t/p/original/lfwwqgMWZn6Th56hHOue9syKO3l.jpg,http://www.youtube.com/embed/wAbGAkkOgcM?rel=0&autoplay=1,"To save her father from death in the army, a young maiden secretly goes in his place and becomes one of China's greatest heroines in the process.","Pocahontas, 10530, http://image.tmdb.org/t/p/w500/qk95miOV8wDABbO5gyCpCrvbVFu.jpg","Tarzan, 37135, http://image.tmdb.org/t/p/w500/tWFubl9q3quYuYXBGypXXCNLE00.jpg","Hercules, 11970, http://image.tmdb.org/t/p/w500/yds93kIrmH1aNN0YKAcHLyOkNEV.jpg","2017-05-14 20:42:22"
10910,41439,"Moulin Rouge",1952,"Biography, Drama, Music","NOT RATED","John Huston","José Ferrer, Colette Marchand, Zsa Zsa Gabor, Suzanne Flon",http://image.tmdb.org/t/p/w500/mdXL304JJhIioZiWp3KBng0te6l.jpg,http://image.tmdb.org/t/p/original/jekwQ138h0KtOaRZ4bv2PvyDesO.jpg,http://www.youtube.com/embed/CKyh4zKkths?rel=0&autoplay=1,"Fictional account of French artist Henri de Toulouse-Lautrec.","Moolaadé, 39504, http://image.tmdb.org/t/p/w500/hGuYfddI8R3VsD8R0FGjGNFmrys.jpg","Young at Heart, 43340, http://image.tmdb.org/t/p/w500/dVz87Oy2FmtRocfWeGMWzPFIVqu.jpg","Jeremy, 61574, http://image.tmdb.org/t/p/w500/wPAJh06nbHhyrViLnOyWHf8ER33.jpg","2017-05-14 20:42:23"
11072,30577,"Blazing Saddles",1974,"Comedy, Western",R,"Mel Brooks","Cleavon Little, Gene Wilder, Slim Pickens, Harvey Korman",http://image.tmdb.org/t/p/w500/yccgwPNVaqtgS1d0U5jjM6Mnza8.jpg,http://image.tmdb.org/t/p/original/tzJmubvEPw2etDhzqpA6Wb3K2EZ.jpg,http://www.youtube.com/embed/VKayG1TrfuE?rel=0&autoplay=1,"In order to ruin a western town, a corrupt politician appoints a black sheriff, who promptly becomes his most formidable adversary.","The Jerk, 6471, http://image.tmdb.org/t/p/w500/wb6mB6R9vscPhyAegbbNDFZUAIs.jpg","History of the World: Part I, 10156, http://image.tmdb.org/t/p/w500/6jOfKftlw1M5cT2oijL3U1Lt6Up.jpg","Young Frankenstein, 3034, http://image.tmdb.org/t/p/w500/a3Bj2ht6liBFafNM46hqk9WEhcY.jpg","2017-05-14 20:42:22"
11969,72008,Tombstone,1993,"Action, Biography, Drama",R,"George P. Cosmatos, Kevin Jarre","Kurt Russell, Val Kilmer, Sam Elliott, Bill Paxton",http://image.tmdb.org/t/p/w500/xYVtxxQjY0ZT80mMu9kyz4A9QR6.jpg,http://image.tmdb.org/t/p/original/mMcHuNXGZON6G9VTBsBIfAbfKBh.jpg,http://www.youtube.com/embed/XTWYKf5hXIg?rel=0&autoplay=1,"A successful lawman's plans to retire anonymously in Tombstone, Arizona, are disrupted by the kind of outlaws he was famous for eliminating.","Young Guns, 11967, http://image.tmdb.org/t/p/w500/wkGbwWHIM23BkmMBm7GQHaCZan8.jpg","Maverick, 9359, http://image.tmdb.org/t/p/w500/vBQjwzheZGwNpLQSdp671X0Nu6O.jpg","Wyatt Earp, 12160, http://image.tmdb.org/t/p/w500/zSGDgcWHqmQxmX4mLJZgT5UgLjj.jpg","2017-05-14 20:42:23"
13898,13862,"The Circle",2000,Drama,"NOT RATED","Jafar Panahi","Nargess Mamizadeh, Maryiam Palvin Almani, Mojgan Faramarzi, Elham Saboktakin",http://image.tmdb.org/t/p/w500/pAwGZCaNWNHx8SKuEHt3ANZwkwt.jpg,http://image.tmdb.org/t/p/original/gTNZBxwv4eOf9m96EP7mtUMJKsY.jpg,"Sorry, No trailer is currently available","Various women struggle to function in the oppressively sexist society of contemporary Iran.","Platform, 80427, http://image.tmdb.org/t/p/w500/vrRfyybUOEIao2AePd6Mr7rOMYv.jpg","La Région Centrale, 90041, http://image.tmdb.org/t/p/w500/n2rdXFqobclt1EKekKwLO65IuTo.jpg","The Intruder, 47143, http://image.tmdb.org/t/p/w500/m2ALncziYzzNjxFXEnNnQLyOUQW.jpg","2017-05-14 20:42:23"
